"","ix","prolific_id","condition","task.input.a_input","task.input.b_input","feedback","correct"
"143",170,"615f2d67574095fe86bfe619","comp_mult","One stick keeps it all the same 2 or more sticks add on 2 blocks","1 stick with any amount of eggs will take away the blocks 2 sticks with any eggs will do nothing and any more will add ","I hope I did alright. ",0
"144",171,"5b83093a3c137500019982b6","comp_mult_reverse","The number of dots on the eggs vs the number of lines on the eggs determines what will happen to the length of the stick.   If the dots outnumber the lines on the egg then the stick will lose however many dots are on the egg.  If the lines outnumber the dots on the egg then the stick will gain however many dots are on the egg.  If both match then nothing happens to the stick.","If the lines on the egg are equal to or greater than the segments of the stick then the stick will gain two segments.","As the test carried on and I saw more combinations of shapes on the eggs I began to have more questions. Maybe I was over thinking this? Im still unsure what the connections are. Oh well! Either way thank you for this early morning study it was a good one.",3
"145",172,"5ad07b06a010190001b35393","comp_mult","My approximate guess is that the number of sticks equals the amount the length of the stick is times by. ie. 1block + 3 sticks = 3 blocks","If the magic egg is touching the stick it is multiplied if its not touching it counts against it.","It seemed confusing to read the full statement and then answering the questions was a lot to remember would have been easier if it was broke into two sections.",5
"146",173,"611c0a8b9a0378d0b648aa0f","comp_mult_reverse","Equal dots and lines leave the sticks unchanged. More lines than dots adds sticks. More dots than lines removes sticks.","Multiply the number of lines by sticks and that is how many sticks. Then subtract the amount of dots. That is your final answer of how many sticks","I still have no clue how they work.",9
"147",174,"61328d86962e07ac2cfa1b95","comp_mult_reverse","If there are more dots than lines the stick will reduce. If the number of dots and lines are the same the stick will stay the same. If the number of dots is less than the number of lines the stick will increase","If there is one line the stick stays the same. If there are two lines the stick doubles. If there are three lines the stick triples.","No",0
"148",175,"610844a211110bcaa4876966","comp_const","Not sure at all. Odd  even numbered lines in the eggs might have something to do with the way the sticks change. ","How ever many dots there are within the egg you would subtract the same number of sticks after the egg hits it. ","The initial questions were VERY confusing and didnt make sense at all. ",2
"149",176,"5f5e95555356a774edb7b5bc","comp_mult","An egg with more than 1 stripe adds 2 blocks.","the dots make the line shorter by their number and the lines increase the ladder when above 1.","I felt like I needed more tests to work it out.",2
"150",177,"5f27f72385b08703d1d81197","comp_mult_reverse","However many lines and dots there are affects the outcome. A magic egg with the same amount of lines and dots as the sticks does not add or subtract. a magic egg that has a dot with more lines than sticks adds the same amount (as the number of dots) onto the stick. A magic egg with less lines the the stick and more dots subtracts the same amount of sticks equal to however many dots there are.","If the number of lines in the magic egg are less than the stick then the stick will stay the same. If the number of lines in the magic egg are the same as the stick then the stick number is doubled. If the number of lines in the magic egg are more than the stick then more is added to the stick so that the lines and stick are the same amount.","No.",1
"151",178,"5c3723564f2e52000177698d","comp_mult","That two or more lines on the eggs makes the sticks longer by 2 sections","Two or more lines on the eggs makes the sticks add two to their length but only if there is one spot on them.","No",4
"152",179,"61006c7ded56391a96ff75a5","comp_const","I think the number of lines corresponds to the percentage of stick length there will be. Each line is worth 100. So one line means 100 of the three sticks meaning it doesnt change. Secondly two lines mean 200 so the two sticks double to four. Lastly three lines mean 300 so one stick triples to three.","I still think the lines on the eggs mean the amount the sticks are increasing but with one line the sticks remain the same by showing 100 of what was there. The dots subtract one block for each dot.","NA",11
"153",180,"5ea4397b9b06662614d6e4f6","comp_mult_reverse","The number of black dots determines the number of segments. In this case the sticks seem to be irrellevant in determining how many segments there will be","The number of sticks are used as a multiplier for the number of initial segments. If there are 2 initial segments 2 multiplied by 2 sticks is 4 total segments as a result. Furthermore 1 initial segment multiplied by 3 sticks is 3 total segments as a result.","I now realise that the number of sticks will be multiplied by the number of segments and then the number of black dots will be subtracted from the new total of segments. Example 3 sticks 2 black dots and 3 segments. You will multiply 3 by 3 which is 9 and then subtract 2 from 9 to get 7 total segments. ",7
"154",181,"6077dd4c0a8ff92267e84b6e","comp_const","The number of stripes correlates to how many times the original number of segments multiplies by.","The stripe does not appear to have any effect but the spots correlate to how many segments are taken away.","no.",10
"155",182,"60479017de62c4000aa25dd5","comp_mult_reverse","The number of dot extends the length of the stick by the number of dots. This is true in all three tests. ","my guess is wrong I am now confused","no",3
"156",183,"5cdbd587763dd00019702450","comp_mult_reverse","I currently dont understand the relationship between the spots lines and the lenght change","Is the relationship stick will time lenght 3 unless their are magic eggs then they will reduce the times by 1 for each magic egg.","Nope",3
"157",184,"5f3931fdadbc8945a3bb166f","comp_mult_reverse","More lines than dots increases the length of the stick.","Even numbers of lines double the length of the sticks.","none",3
"158",185,"612537a07969bc6fb1d5d070","comp_const","The number of segments on the original stick multiplied by the number of stripes on the egg gives you the new number of segments (1x3=3 2x2=4 3x1=3)","Number of segments multiplied by number of lines minus number of spots.","Good experiment",11
