"","ix","prolific_id","condition","task.input.a_input","task.input.b_input","feedback","correct"
"71",98,"572cc0683a394a000e0c81fc","comp_mult_reverse","The dots tell you how many blocks in the stick there will be ","no idea my previous guess was incorrect","I thought I had the right idea about the dots at least but the practice made me realise that I was incorrect on that part so it didnt make sense to me at all. I couldnt spot a pattern in the behaviours so I applied my own rules to the game to provide an answer structure to participate in the game with. I clicked that it was difficult to complete the learning task but the instructions were simple I just couldnt work out what the pattern was. The money element wasnt a big enough of a motivator so I didnt really feel that it was important for me to try harder than I already was. Perhaps if you were to run the task again you could put in a piece about how important the results are for your research to see if that changes the results.",2
"72",99,"6156ee61901c987ea794cca8","comp_mult_reverse","Stripes make the sticks grow. Dots make them shrink. An equal number of both cancels the effect. Not sure of the effect of unbalanced ratios yet. ","If there are more dots than stripes this destroys the stick. Otherwise the ratio of stripes to dots controls how much the stick grows by. Stripes are positive dots are negative. My limited maths cant work out the numerical details. ","Ow my brain hurts.",2
"73",100,"55f2a7e332af740010170166","comp_const","the number of stripes on the egg multiplies the sticks. 1 stripe = x1 2 stripe = x2 3 stripe = x3","each spot on the egg takes away one stick","no",11
"74",101,"5c0a4795d56d2200015a7e3f","comp_mult_reverse","All spots on the eggs need to be touching the sticks to have any effect on the outcome.","The number of blocks are multiplied by the amount of sticks on the eggs","I have no additional comments.",4
"75",102,"5cb75d063fd2880012371a40","comp_mult_reverse","The magic egg with one stripe and three dots caused the stick to disappear. The magic egg with two stripes and two dots didnt affect the stick at all and the magic egg with three stripes and one dot caused the stick to become shorter.","The egg with one stripe didnt affect the length of the stick. The egg with two stripes made the stick longer by two segments and the egg with three stripes made the stick longer by three segments.","It was interesting to try and guess.",1
"76",103,"6160c479b2b259ba288b8f1d","comp_const","the stick segments are multiplied by the number of lines in each egg. e.g. 3 (egg) x 1 (stick) = 3 stick segments","for every dot in the magic egg it takes away one stick segment e.g. 3 dots in the magic egg would take away 3 stick segments","I have no comments regarding the experiment other than it uses algebra and abstract thinking to figure out x and they apply it to other equations.     the task wasnt that difficult but thats because I didnt find mathematics hard at school. I imagine this would be hard for someone who isnt gifted numerically.",8
"77",104,"5e3c6fb7b9d2b9055f2b6448","comp_mult_reverse","I cannot see a pattern currently.","That you multiple the sticks versus the lines in the eggs","I would love to know if I was correct or not!",4
"78",105,"597cfa6240ffde000164484c","comp_const","Stick length is multiplied by the number of lines on the egg.","The stick length is multiplied by the number of stripes but reduced by the number of spots.","",11
"79",106,"5c05510b891bb4000121a227","comp_mult_reverse","I really cannot get my head around it.  Something to do with the sticks without dots makes and increase but the dot touching a stick cancels it out.","The sticks have a positive affect and the dots have a negative affect.  I think the sticks multiply by how many sticks.  The dots perhaps divid or minus?","No comment",6
"80",107,"60e9b38e2eed5f910a1c4f45","comp_mult","Two lines in the magic egg means that the stick grows two more sections.","when there are 3 lines patterns on the egg one extra block is added to the stick.","Everything was clear and easy to follow the instructions given",2
"81",108,"5ef7ac2cc347580e1795f9f2","comp_const","Having more than one diagonal line adds two length units to the stick.","Having 2 or more lines adds two length units to the stick. Remove one length unit of the stick for each dot that is on the egg.","The truefalse knowledge check has some questions worded in a way that it makes it difficult to figure out what exactly is being asked.",2
"82",109,"612fa57ac45f393b3531fcfb","comp_mult","The number of lines are a multiplier for the number of sticks.  1 line will not change number of sticks 2 lines will double number of sticks and 3 lines will triple number of sticks.","(Number of lines x number of sticks) - number of dots","Interesting",9
"83",110,"5d56d465175b5d0017766b3b","comp_const","The stripes effect the length of the sticks. 1 stripe is no change 2 stripes is +2 and 3 stripes is +1. ","The stripes make the sticks longer and the dots make them shorter again. It does not matter where the dots sit on the egg they always make the stick shorter. ","na",1
"84",111,"61485d949d2aaf377ed08578","comp_const","two boxes are added if there are more than one stripe","The more dots in the circle the more sticks disappear so if there is one dot only one stick disappears but if there are three then three disappear ","None",2
"85",112,"5ec059d21ea97a4723d97fdf","comp_mult","its the number of stripes in the eggs x the number of segments = equals the new length of stick","The segments increase by the number of dots in the egg","None",4
"86",113,"6058e67eb40dd79ef0d4496f","comp_mult","single-line does nothing two lines double the length of the stick and three lines triples the length of the stick","same rule for the lines apply except now you take away the number of dots","na ",9
"87",114,"5d34a440c5edfe0001f7c53c","comp_const","The stick length after the magic egg has touched them becomes multiplied by the number of stripes on the egg. Eg: 3 stripes on egg touches stick 1 square long it will become 3 squares long (1x3)","Length of stick is multiplied by number of lines on egg then number of spots is subtracted","na",10
"88",115,"5bf96547ab02ea000169bd7f","comp_mult","The number of stripes is a scalar value that is multiplied with the number of segments","The stripes are a scalar that multiples against the number of segments The number of dots are then subtracted from the multiplication of the stripes and segments","Na",11
"89",116,"6014276b8ccd2211b4fc5074","comp_mult","The number of stripes on the egg determines the number the stick will multiply by. For example 3 stripes mean the stick will multiply thrice its size ","Stripes multiple the stick by the amount of stripes in the egg. Dots deduct the length of the stick by the amount of dots in the egg ","I was not 100 what an empty egg would equate to. Sure it would be zero? But mathematically some sticks would be in the minuses! ",14
"90",117,"5efcbd999aad650a6e316a7f","comp_mult","The number of segments in the stick is multiplied by the number of stripes on the egg.  For example if the stick starts off with 2 segments and the egg has 2 stripes once the egg touches the stick the stick will increase to 4 segments (2 x 2 = 4)","The effect on the number of segments in the stick is determined by first multiplying the number of segments by the number of stripes on the egg then secondly subtracting the number of spots.","",11
"91",118,"5f632c08d6e28a3c37caf9a5","comp_mult_reverse","The number of stripes denotes the type of action - 1 stripe reduces segments 2 stripes changes nothing and 3 stripes adds segments. Then the number of dots denotes how much this is done by - e.g. 1 stripe and 3 dots removes 3 segments","As said before stripes denote action - assumed below 2 removes above 2 adds on and 2 does nothing - dots denote value of action - e.g. how many to add. If not dots present them number of stripes multiplies number of segments","na",7
"92",119,"5e203f2125a4d03519e4d0fe","comp_mult","The stick segments are multiplied by the number of stripes.","The segments are multiplied by the number of stripes before subtracting the number of dots.","That was fun!",10
"93",120,"5e7dd515aa9da60009e412f2","comp_mult","the number of segments in the stick is multiplied by the number of lines in the egg","the number of segments in the stick is multiplied by the number of lines in the egg and then the number of dots in the egg is subtracted","na",13
"94",121,"5ba4e80b38803d00012630fd","comp_mult_reverse","eggs with more dots than stripes make the stick shorter eggs with the same amount of each do nothing and eggs with more stripes than dots make the stick bigger.","having 1 stripe will keep it the same unless theres a dot on that stripe then itll shorten the stick the stick will get bigger by 1 for every stripe above 1 on the egg but not if theres a dot on that stripe","nope",3
"95",122,"5efa06a7540ce97e3ed866f8","comp_const","Eggs with 2 stripes make sticks 2 times bigger but the ones with 3 stripes make them only bigger by 1 whereas 1 stripe egg doesnt change anything. This means eggs with 3 stripes always change lenght of the stick the most","The more there are dots in the egg the smaller is the stick","No",1
"96",123,"5996ec910ed7ae0001991755","comp_mult_reverse","the dots seem to match the number of blocks in the original stick length. the lines seem to match with a unique action. 1 line = remove 2 lines = keep 3 lines = add. The number of blocks to do this action on could be indicated by the number of dots.  e.g. 1line+3dots = remove 3 blocks.  2lines+2dots= keep 2 blocks.  3lines+1 dot = add 1 block.","the lines seem to indicate the multiplication factor of the blocks. i.e. 3 lines = 3x the original blocks. The number of dots seems to indicate the number of blocks to remove after multiplying. e.g. 3lines+1dot applied to a 1-length block = (3x1) -1 = 3-1 = 2","no comments",8
"97",124,"5f870e6712b6c10a689125ac","comp_const","The number of stick segments multiply by the number of stripes on the egg","the number of stick sections are multiplied by the number of stripes on the egg; then the same number of sections are removed as there are dots on the egg.","Enjoyed this thank you.",11
"98",125,"5f8c5a729f6c7c3a4b71dc0e","comp_mult","additional sticks make the blocks 2 longer","3 dots takes 3 away 2 did nothing and 1 added so the less dots the more added","nope just interested in how it did and what the causal link was",0
"99",126,"6152c5cd4bbadde55f50c1fa","comp_mult","two stripes on the egg doubled the number of segments in the line three stripes trebled the number of segments.","The dots reduce the number of sections on the lines and the lines seem to increase the number of sections.","It was rather difficult to work out the connection.  ",3
"100",127,"60a43c0502ddacdbecbfb90f","comp_mult","1 stripe = x 1  2 stripe = x2  3 stripe = x3 ","I dont think the dots make a difference 1 stripe = no blocks  2 stripe = stay the same 3 stripe = + 1","just wondered if we find out if we got it right or wrong ",6
"101",128,"5d22106bb75abb0017131595","comp_mult_reverse","more spots there are the smaller the sticks","one stripe stayed the same. 2 strips doubled. 3 stripes added 1more ","Didnt make much sense",2
"102",129,"54f225d6fdf99b66cd167ef3","comp_const","Multiplying the number of stripes in the egg with the number of segments that the stick has to begin with equals the final number of segments in the stick after the egg affects it.","The number of stripes in the egg is multiplied by the original number of segments in the stick and then the number of dots is subtracted from that answer to give the total number of segments in the stick at the end. So  of stripes x original number of segments - number of dots = Final number of segments.","I really enjoyed doing this experiment it was a lot of fun!",9
"103",130,"614ac76ed392a7cd817b2170","comp_mult_reverse","If there are more dots on the line you decrease the section of stick by the overall number of dots. If they are the same (on and off the line) it stays the same. If there are more dots off the line you add by that many dots","You multiply the lines in the eggs by how many sections there are in the stick","The quiz at the start needs to be rethought. Some of the questions are not worded nicely and the answers are assumed on common sense rather than obvious in the text.",8
"104",131,"5f14359cc1b7a74789b1075c","comp_mult","The more lines the less boxes are added . ","The more eggs in the circle the less boxes appear ","No",3
"105",132,"5ea71cf65bc7010dd379cdae","comp_mult_reverse","I believe that the difference in the three is caused by the amount of lines the first was 3 dots to one line so it was over powered and they were gone. the second was equal so they stayed the same and the third had two more lines than the one dot so they gained a green block","i believe the value of the first line is makes no difference to the starting length of the green blocks. its when more are added in that it increases  up to the value of two extra blocks. there could be twenty stripes and it would only increase the value by two","Thank you  ",2
"106",133,"60422e525042bc0615f57583","comp_const","When the eggs have one strip it stays the same when it has two strips it will be two more when it has 3 strips it goes up two .","When thy have dots they loss bars .If it has two dots two bars a lost .","It was a fun and different survey and I liked it a lot.",2
"107",134,"6150c827a75af626fd34d8fc","comp_mult_reverse","if there are more lines than dots it will increase in size. if there are more dots than lines it will decrease in size. an equal number of dots and lines will results in no change","the lines are multiplicative ","no thank you ",2
"108",135,"612706016683ef8d601ab900","comp_mult","middle line means no change and the two on the outside add 2 extra bars","middle dot adds one the left dot minus one and the right down minus 3","na",2
"109",136,"6048cd6bae925308a37a5e75","comp_const","1 strip on an egg will not produce any result more than 1 stripe always adds two segments to the stick length","The balls decrease the length of the stick as per the number of balls present on the eggs. For stripes>1 the length of the stick is increased by two segments","None",1
"110",137,"5ee625b0e1640f3738d8a5b6","comp_mult_reverse","spots reduce length by one and stripes adds by one","spots make the length shorter by 1-1 and each srtipe over 1 adds one eg 2 stripes adds 1 3 adds 2","none",1
"111",138,"61479f6bca6b3384a1023632","comp_mult","At least 2 stripes seen on a magic egg will lengthen the sticks by 2.","Each dot on the magic eggs gets rid of a section of the stick but 2 or more stripes still adds two sections as before.","No questions. ",3
"112",139,"5c63e773f9b6300001c9ce20","comp_const","Magic eggs with more than one stripe can have an effect on the length of the sticks.","The number of spots on a magic egg determines by how many components a stick will shrink. The number of stripes determines by how many components of a length the stick will elongate. If there are spots and stripes on a given egg the effect of the spots takes precedence over the stripes.","No.",1
"113",140,"616032d21a16435a9ef61c93","comp_mult","the number of lines is the number of time the segment number is multiplied e.g 1 line=x1 2 linesx2 3 lines=x3","same as before. except the number of dots reduces the multiplication factor.","Id be interested to know what the actual rule was.",6
"114",141,"61083d35fd7444959d84f283","comp_mult","The number of lines in the egg is the factor by which the number of stick segments multiplies. for example 2 egg lines the stick segments multiplies by 2.","The egg lines are the multiplying factor and the egg dots are a subtraction factor. So if you start with an egg with 3 lines and 1 dot you multiply the sticks by 3 and subtract 1.","no",10
"115",142,"5fbba080d884e1d04debebb9","comp_mult","The number of segments (i.e. total length) correlates with the number of sticks. If you have an odd numer your segments will be added such that there are odd segments. This is why when an egg with three sticks only increased the length by two sticks to keep the length odd","I think the number of spots and stripes matter for the overall length. If the are more spots than stripes the length of the stick diminishess if there is an equal number no change detected.","This is a really tricky task. The contrast in colours hurt my eyes a bit too.",1
"116",143,"5c9a532039138e00179a4f7a","comp_mult_reverse","I think if the dots are contained in a line then it means you dont lose segments. if a dot appears outside a line then you lose the amount value of the dots in segments. if dots and segments match and dots are on lines and theres no difference in value then no change ","the red line multiplies it?  and the dots either add or subtract them?","really interesting! was fascinated trying to figure it out! ",5
"117",144,"615bf214a1e078163ac4fc3b","comp_mult","It multiplies the stick length by the number of lines in the egg","Multiply by the number of lines and then subtract the number of dots","It was a really different type of experiment which I enjoyed. I am interested in the results of this to see if I am right! ",7
"118",145,"5b082f3d61cde20001b6706e","comp_const","It multiplies by the number of lines on the egg and the original stick","The number of dots indicate how many sticks will be taken away.","Interesting survey",3
"119",146,"5c50567dddf94000017cf46d","comp_mult_reverse","The stripes may matter more than the dots .","more than 1 stripe causes the length to increase. ","No.",4
"120",147,"5baab2941156920001986d2b","comp_mult_reverse","some of these magic eggs are magnetic","the stripes mean how many boxes will remain. ","no ",4
"121",148,"612790352d8f05c1c9d01001","comp_const","one line in egg has nil effect on length of stick  two lines in an egg doubles the length of  a stick ( which has 2 blocks originally associated with it)  three lines in an egg triples the length of a stick ( which has one block currently associated with it)  ( unsure as of yet as to whether the length of the sticks were different to above would the eggs still have the same properties of eg doubling and tripling length of stick ","one dot and one line in egg reduces length of stick by one block 2 dots and one line reduces length of stick by 2 blocks 3 dots and one line reduces length of stick by 3 blocks.","unsure if Ive answered correctly ",6
"122",149,"5f765d6a853bd40f49799ab1","comp_const","You multiply the length of the stick by the number of stripes on each magic egg.","You subtract the number of dots on each magic egg from the sticks. Its possible you still multiply by the stripes by cant be confirmed as all examples only had one stripe.","I enjoyed it. ",11
"123",150,"5f4b6e0114b99101ba69e5ae","comp_const","the eggs can only add 2 blocks of length which is why the first egg did not add anything and the third egg only added 2 blocks of length was because the single stripe does not add any length. This would mean only 2 stripes add length so if there were an egg with 4 stripes it would add 4 blocks of length.","I believe that every 2 stripes bars of length are added. When there are dots on the egg the bars length are subtracted depending on the number of dot.","The experiment was difficult.",2
"124",151,"5f8ed1c0d144ff0750c5c426","comp_mult_reverse","the dots in the circle a related to the number of blocks in the strip. If one bar in the circle you reduce the strip by the number of dots. If three bars in the circle you add to the strip by the number of dots. If there are two bars in the circle the number in the strip should be the same as number of dots","I feel like my first guess was completely incorrect and I have no idea what the bars or circles in the magic eggs do to the strips","I wish I was smarter and could figure out the logic of these eggs",2
"125",152,"6159dfbdd9d4b9b1e8957fc0","comp_const","The length is multiplied by the amount of stripes on the magic egg. 1 stripe remains the same 2 stripes doubles the length and 3 stripes triples the length","The number of dots is how many lengths is removed. 1 dot removes 1 segment 2 dots removes 2 segments and 3 dots removes 3","No ",4
"126",153,"5cd8996bdf739100011b1f3e","comp_const","The first egg did nothing.  The second egg with 2 stripes made the stick grow by 2.  The third egg made the stick grow by 2.","The dots make the stick shorter.","It was interesting.",2
"127",154,"5ee68f115b2240401d54114b","comp_const","Number of stripes multiplied by number of blocks = new number of blocks. E.g. 1 stripe x 3 blocks = 3.  then 2 stripes x 2 blocks = 4.","Stripes x blocks then the balls takeaway. E.g. 1 stripe x 3 = 3 minus 3 balls = 0","none",9
"128",155,"5c4792a53fa2f8000186d844","comp_mult","The magic eggs above two and three - add two lines. ","This now is more difficult - I am uncertain for this one. ","NA",0
"129",156,"5c28efb626e55d0001a685b1","comp_const","stripes do not increase the length of the sticks","spots take away sections of sticks 1 spot takes away 1 section 2 spots takes away 2 sections etc","It would be interesting to know what it was testing  ",1
"130",157,"5fce85f6b054b20d5dbf4a1e","comp_mult","Eggs with stripes that equal or exceed the lenght of the stick increase the lenght of the stick by 2 when they come into contact","Eggs with a number of stripes that are equel to or higher than the length of the stick increase the length by 2. While each dot decreases the length by 1.","No",1
"131",158,"5eda1ab8acd3f65b5f474957","comp_const","It multiplies by the amount of stripes present","The eggs with the dots decrease the sticks","no ",3
"132",159,"5f2955a116fd780276fa37e9","comp_mult_reverse","WHEN THE EGG HAS ONE STRIPE IT CAUSES THE STICKS TO DISAPPEAR ALL TOGETHER WHEN THERE IS TWO STRIPES THE STICKS STAY THE SAME AND WHEN THERE IS THREE STRIPES IT REMOVES ONE STICK","THE FOURTH EGG CAUSES THE STICKS TO STAY THE SAME AMOUNT. THE FIFTH EGG CAUSES THE STICKS TO MULTIPLY BY TWO AND THE SIXTH EGG CAUSES THE STICKS TO LOSE TWO.","I have no further comments.",2
"133",160,"60fd20c8047509fa826021fc","comp_mult_reverse","Equal amount of sticks and spots cause no change. More sticks than spots cause the length to increase and less sticks than spots cause the length to decrease.","the amount of sticks determines how much the length increases by eg if there are three sticks the length will multiply by three.","NA",3
"134",161,"592c3abc7d3b760001a287b7","comp_mult_reverse","3 dots means the sticks disappear 2 dots means 2 sticks 1 dot means add another stick.","Times the number of stripes by the number of sticks to get the number of sticks when they touch.","no",3
"135",162,"61530d287ad99f144578cc26","comp_mult_reverse","If there are 2 more sticks than there are dots this adds 1 segment to the stick. If the stick to dot ratio is the same the stick stays the same length and if there are more dots than sticks the stick gets shorter","The amount of blocks after merging is the amount of blocks to start with multiplied by the amount of sticks","Very difficult",3
"136",163,"562a52d2c8ffc2000f5139dd","comp_mult_reverse","It appears that the dots make the sticks shorter 3 dots made 3 segments of stick disappear the lines seem to make sticks longer but they are weaker two lines could only increase one segment of stick so a line may increase half a segment? This works on the assumption that the dots and lines cancel each other out since in second example two dots and two lines made no change to stick","A line increases a stick by half a segment if it is an odd number of lines and a full segment if it is an even number of lines. A dot cancels out a line and a line cancels out a dot a dot decreases a stick by a full segment","I enjoyed it",2
"137",164,"614713288cea66f64d6dd79b","comp_mult_reverse","The amount of lines touching 1 dot will equal the amount of segments in the stick i.e. if a dot is touching 2 lines then the stick will be made of 2 segments If multiple dots are touching a line the stick reduces to 0 segments ","times the original segment by the number of lines and minus a segment for each dot ","NA",10
"138",165,"5f36ba1b5efc210b15d8a1fc","comp_mult_reverse","How many dots lie on top of a line","The lines multiplied by the number of segments on the stick minus the number of dots","No.",9
"139",166,"5dd40f2db2204f3ee690f9f9","comp_mult","The number of sticks in the egg has to be larger than the number of segments. ","I now think that sticks in the eggs mean addition but that dots in the eggs mean subtraction of the number of segments","Usually Im fairly good at these types of tasks but I found this one confusing and that made me feel a bit frustrated! Perhaps I didnt spend long enough on it or Im a bit tired today. Also I found the long text of instructions at the beginning hard to absorb. Anyway it was still engaging for me!",4
"140",167,"5f1db717e2aa497071780d33","comp_const","the number of lines on the egg causes the degree of how long the stick grows (i.e: 2 lines doubles the length 3 lines triple 1 does nothing or multiplies by 1)","The dots on a egg will decrese the length of a branch by 1 unit and then after that the number of lines will be what the length is multiplied by as shown in the first description (1 line multiply by 1 2 lines multiply by 2","na",6
"141",168,"5bf571c7d944c300012629cf","comp_mult","over 1 stick doubles the length","no matter the sticks 1 dot doubles 2 dots do nothing 3 or more remove the length","na",1
"142",169,"596e1cc639e9d00001b7bb84","comp_mult_reverse","3 dots makes the line shorter 2 dots leaves the line the same lengh 1 dot increases the line ","1 line on the egg makes the stick stay the same 2 lines doubles the lengh 3 lines adds 2 to the lengh ","no none ",2
