"","ix","prolific_id","condition","task.input.a_input","task.input.b_input","feedback","correct"
"1",28,"5dadd3c286daf200165076c6","comp_mult_reverse","I believe that that spots touching the lines does not matter though the amount of lines on the egg matter. With 1 line it makes all sticks disappear whereas with 2 lines they stay the same and with 3 they add one.","The amount of lines means you double the sticks by the amount there is to increase the amount of lines.","None that I can think of",3
"2",29,"5f0649c1be64611a6cdd7980","comp_mult_reverse","When the black balls are larger than the amount of the orange sticks the amount of segments that equal to the number of black balls on the eggs disappear.   When the balls equal the number of orange sticks nothing happens.   When the amount of orange sticks is larger than the black balls the amount of black balls becomes the amount of segments that is added to the segment count. ","If there are no balls present and the amount of sticks either equal or are larger than the amount of segments then we will add two segments.   Everything from before is true with the addition of this statement. ","This was fun ",1
"3",30,"5c2a1d9a0bd9fd0001f322a1","comp_mult_reverse","If there are more dots than sticks it removes segments. If there are more sticks than dots it adds segments. If there are the same number of sticks and dots the number of segments stays the same. ","Well now Im just confused. Im going to stick with my previous guess - more dots = remove segments more sticks = add segments UNLESS its just one dotsegment in which case nothing changes. But I genuinely have no idea Im sorry!","Please tell me I get to find out what the pattern is if not the lack of closure will drive me insane!",3
"4",31,"599744029039240001432213","comp_mult","One stripe does nothing two stripes doubles the stick and three stripes triples the stick. ","The stripes increase the stick by the same number (3 stripes triple 4 stripes quadrupleetc) but the dots decrease the stick by taking away how many segments there are dots. ","It was fun to figure out the relationship. I felt confident after a few minutes.  ",12
"5",32,"5cbf563b2ceae00018916393","comp_mult","the number of lines in the egg multiplies the segments in the stick e.g. 2 line egg multiplies the segments of the stick by 2","3 dots is remove all segments. 2 dots is stay the same. 1 dot is halfminus 1","None",3
"6",33,"5d39b2d8bef6e600169d3861","comp_mult","The number of stick segments is multiplied by the number of egg stripes","New stick segment number = original stick segment number multiplied by number of egg stripes then minus the number of egg spots","The attention check questions were a little confusing but i got there eventually!",10
"7",34,"5dbae2122a1dd60f179ddca8","comp_const","the number of stripes in the egg indicates how many times you multiply the number of stick segments by e.g. 1) egg=1 stick =3 --> 1x3=3 so stick length stays the same  2) egg=2 stick=2 --> 2x2=4 so stick length is now 4   3) egg=3 stick=1 --> 3x1=3 so stick length now 3 ","so as said above the lines indicate how much you multiply the number of stick segments by and now i know that the dots indicate the number of segments to deduct e.g. 4) lines=1 spots=1 stick=3 --> 3x1-1=2","no",13
"8",35,"5eb3dc89ec54901c1b1fa542","comp_const","adds 2 segments to the stick only if there are 2 or more stripes on the egg","for each dot on an egg a segment of the stick is removed","no",2
"9",36,"601da1e1dc8ed915bfea84f0","comp_mult_reverse","the reverse is happening for whatever reason. when the lines and dots are equal nothing changes. hte last option thorugh me off with adding the square. ","the more lines that there are above one adds on two blocks but the dots remove one ","na  ",3
"10",37,"5c5d5fed13005e0001ab6e70","comp_const","The number of squares in the stick multiplied by the number of lines in the egg equals the new length of the stick","The number of squares in the stick multiplied by the number of lines in the egg minus the number of dots in the egg equals the new length of the stick","I found it pretty interesting and think that I came up with the correct idea as it seemed to work on each of the tests but I would love it if we get feedback on how we did",9
"11",38,"5f53baa0462e520a7571b901
","comp_const","Eggs with 1 stripe have no effect on the length (number of segments). 2 or more stripes on the egg increase the length by 2 segments.","The dots take away a segment of length per dot.","none",2
"12",39,"5d21c97b1eae150018e77606","comp_mult","The number of lines multiplies the length of the stick. So 1 line stays the same 2 lines doubles the stick length 3 lines triples the stick length","The lines multiply the length of the stick and then take away a length of stick for each dot there is.","I enjoyed it. I enjoyed working out the patterns as I like maths problems.",10
"13",40,"5f045b6fc017076b9360eef5","comp_mult","one stripe does not change the stick in any way 2 or 3 stripes both added 2 sticks. ","the dots take away a stick so he first example shows that one line makes no difference however the 3 dots then take away 3 sticks. example 5 ad 6 both add 2 sticks but take away 2 or 1 stick because of the dots ","quite interesting to try and figure out so therefore it is engaging",2
"14",41,"5d402ba19b264e001690ec88","comp_mult_reverse","The egg with 3 dots and 1 stripe makes the stick disappear.  The egg with 2 stripes and 2 dots didnt alter the stick. The egg with 3 stripes and 1 dot increased the size of the stick by 1.   As the stripes increase after 2 on the egg the stick should grow.","egg with 1 line will not multiply the stick size. egg with 2 lines will multiply by 2. egg with 3 lines will multiply by 3.","NA",3
"15",42,"5fbadc5fb1a235b6e97f0859","comp_mult","1 stripe does nothing 2 stripes adds two blocks and 3 stripes adds 1 block","3 dots removes 3 blocks 2 dots does nothing 1 dot does nothing","no",2
"16",43,"5c7c6a0e28933500015ec7da","comp_const","The length of the sticks is multiplied by the number of lines on the egg.","The length is multiplied by the number of lines and then the number of dots is subtracted.","It was annoying that in the first half of the task I didnt actually have enough information to answer the question.",11
"17",44,"5f4c936f6cc10e89ebf276b4","comp_mult","a single strip means the stick will not change the double strip egg means it will add 2 bars and the triple strip egg means it will change the bar to 3","strips and black dots on the magical eggs must add or subtract something about the bar i am not really sure ","I was very confused ",5
"18",45,"5e9f1fd1ccad1908bdb9f8f7","comp_mult","i think the number of stripes on a magic egg causes the number of stick segments to multiply by the number of stripes on the magic egg","i think the number of stripes on a magic egg causes the stick segments to multiply by that number and then reduce by 1 segment for every dot on the magic egg","none",12
"19",46,"5f3ace39af40ed76c7714b1b@email.prolific.co","comp_const","One stripe has no effect on the stick. Two stripes and three uneven stripes increase the length of the stick by two blocks","The number of dots is the number of blocks that must be removed from the stick","I do not have any comments",2
"20",47,"5cbef0a9a9b23200139ebcfa","comp_const","Having extra lines adds extra length to the stick ","Dots take away the same number of lines ","It was quite interesting. Will be interested to know the answers ",2
"21",48,"5f3ab64e0dda76127bcc344e","comp_mult","The number of stripes seem to matter  seems like if the number of stripes is greater than or equal to the number of segments on the stick it adds otherwise it doesnt","So the dots seems to cancel out the number of segments added if there are 3 segments and 3 dots and the stripes is less then it is 0 so you have to subtract stripes from dots and then you can figure out how many to add","None",3
"22",49,"603e586528b8f0e977b61778","comp_mult_reverse","The amount of dots on the eggs equates to the amount of segments on the stick. The more lines on an egg the less segments on the stick there is.","The odd amount of lines on the egg doubles the amount of segments on the stick. If it is an odd number of lines on the egg the segment amount stays the same","Was a little confusing.",3
"23",50,"5f454ee36eaa951147ea3cb4","comp_const","i think if an egg has one strip inside the it is not enough to cause any change in he ticks it gets in contact with ","the number of black dots on the strip inside the egg determines how many segments decreases from the stick","it was an interesting challenge. ",2
"24",51,"5ec637f5e0bca2000ae6f211","comp_mult","You times the number of sticks by the number of segments. For the second one there are 2 sticks and 2 segments so 2 x 2 = 4. This means there are 4 segments.","You still do sticks time segments but then you minus the number of dots to get the end number of segments.","No",11
"25",52,"5ecface109d61f0120937435","comp_mult_reverse","The relation is where the dots are placed within the egg and its relation to the lines","The stick multiplies based on how many lines are within the egg","No",5
"26",53,"5b74960f218c0f000107d480","comp_const","The number if stripes is multiplise by the number of sticks","The number of stripes is multiplied by the number of sticks and the each dot removes one stick","none",10
"27",54,"603577daa2c4702666b68f55","comp_const","The number of stripes on the magic egg multiplies with the number of segments on the stick to increase the number.","The stripes multiply with the segments whereas the spots on the magic egg indicate minus 1. ","I found the experiment pretty engaging and felt that by the end of the study I was quite sure of my answers",10
"28",55,"5db03383d00dbb001619b598","comp_const","1 line no change - 2 lines 2 change 3 lines 2 change","The dots take lines away whereas the lines add some on.","NA",2
"29",56,"59e71906ac0af70001b36a06","comp_mult","If the number of stripes on the egg is higher than the length of the stick then the length of the stick will increase. If the number of stripes on the egg is lower than the length of the stick then no change will occur. ","If the number of stripes on the egg is higher than the stick then the stick will increase by the number of spots on the egg. If the number of stripes on the egg is lower than the stick then the stick will decrease by the number of spots on the egg. ","No ",1
"30",57,"5ca73fe6bcdcc2001291822d","comp_mult","Any more than 1 line causing the stick to increase by 2","i dont have a clue!","NA",4
"31",58,"5ed788a796035b21e02a6ab8","comp_mult","More than one line on the egg means 2 lines are added","Each dot removes a stick. 2+ lines on the egg add 2sticks","Would be interested to know if I got it right! ",2
"32",59,"5a0de5e19b760100013a78ac","comp_mult","The number of stripes multiplies the number of segments","The lines multiply the original amount but each dot on the egg removes a segment","No comments...it was fun",8
"33",60,"5e4e99008a243d2de0005023","comp_mult","The lines matter. One line doesnt make a difference. Two lines double the number of segments. Three lines doubles the segments then takes away one. ","The number of lines multiplies the number of segments. Each dot takes away one segment.","no",10
"34",61,"5a52164aac5624000153602a","comp_mult_reverse","if the stripes are more numerous than the stick then the stick will increase.  if the stripes are less then it will disappear.  if stripes the same then no change.","Some interaction of stripes and spots dont know what. More stripes will increase stick if stick is smaller","Im rubbish at this",0
"35",62,"5d31c6bac88f0e00164c3ccb","comp_mult","I think stripes from magic eggs increase the number of sticks","I think the dots do something other than stripes Im not sure but they probably reduce the number of sticks","A rather tough experiment Im not good at this type of task.",2
"36",63,"5ea990b19e16b70b2c85bd55","comp_const","The number of segments added to the stick depends on how many stripes the egg has","It seems like the stripes add segments but if theres is spots it takes away","Im still not sure of the answers!",2
"37",64,"5cc3754ba757bd0015332a48","comp_mult_reverse","1 line is - how many dots is -3 lines. 2 lines is = (nothing changes is dot number is equal to lines) 3 lines is + how many dots ","1 line makes no changes. 2 lines doubles amount of lines. 3 lines ","no.",2
"38",65,"5ee4f34eadd4be0675a74a0a","comp_mult_reverse","If there are more spots than stripes the stick will get shorter","Multiply the stripes by the sticks and that gives the end length of the stick","It would have been good to go back  correct the first guess after doing more tests",10
"39",66,"575850aaa187de0006056128","comp_mult","If the number of lines is greater than 1 the stick will increase in length by 2","If the number of lines on the egg is greater than 1 the stick will increase in length by 2. However for each black dot on the egg the stick will decrease in length by 1.","You promised fun it was!",2
"40",67,"5962ceff8474920001bd266e","comp_mult","You multiply the number of number of lines in the egg by the amount of sticks. The result is the length of the stick. ","By the end I believe I figured it out. What happens is you first multiply the amount of lines in the egg by the amount of stick segments. Once you do that you then subtract the number of dots within the magic egg. The result is your final stick segment length","Everything seemed to work well thank you!",12
"41",68,"5f0a04205a17782c34fcb466","comp_mult_reverse","if the egg has one stripe and 3 dots the stick gets shorter if it has two stripes and two dots the stick stayed the same and if it has three stripes and only 1 dot the stick browns longer. ","the dots change the length of the stick negatively in the way that they make it shorter. For each dot one unit of the stick is taken away.  However the stripes make the sticks longer. If there is one stripe only then the stick will stay the same length. If there are more than one stripe however then the stick will increase in length by two units.  When thinking how the egg effects the stick overall you must first take into account the stripes and add on any units that need to be added on if any. Then you must take into account the dots and take away the amount of units that there are dots. For example if the egg had five stripes and 1 dot then the stick would overall increase by 1 unit as 2-1=1.","no.",4
"42",69,"601ff4b514b1d3385d6bf173","comp_mult_reverse","If the spot touches a stripe on the magic egg then it will decrease the length of the stick when the egg touches the stick. If the spots dont touch any stripes then there is no effect on the stick when the egg touches it.","An egg with only stripes and no spots increases the length of the stick to be equal to the number of stripes in the egg. 1 stripe in an egg has no effect on the length of the stick.","Interesting study. Very mind provoking. Requires a person to read carefully and try hard to understand the given tasks. ",0
"43",70,"5e4adfc1aaef1b02a763644d","comp_mult","The number of sticks in the egg correlates to how much the sticks multiply in length. For example test 2 starts with 2 spaces and doubles in size matching the 2 sticks in the egg. Test 3 begins with one and becomes 3 being multiplied by 3.","The addition of spots in the egg introduces a divisible action - in some cases depending on where they are positioned some blocks are removed. However in some cases there is no change  additional blocks are added. The positioning of the spots is what affects the type of effect on the blocks.","NA",6
"44",71,"5d11497994d33a000123fc3a","comp_mult","more lines in the eggs add to the length of the stick","if there are more dots than lines then the stick decreases in length if there are more lines than dots then the stick increases in length and if the dots and lines are equal then theres no change","no comments",2
"45",72,"60e7f21feb04fbccd8b80081","comp_const","One stripe makes no change.  Two stripes doubles the sticks. Three stripes triples.","One spot takes one stick away.  Two spots take two sticks away. Three spots take three sticks away. ","I found the experiment quiet difficult to understand although I am certain I guessed how each egg worked but I had to concentrate very hard to come up with the answers. ",10
"46",73,"5eefc8211f1b2a4c3a1ab38e","comp_const","I think it’s a multiplication system - 1 stripe means it is multiplying the 3 blocks by 1 therefore leaving it with three. 2 stripes is multiplying the blocks by 2 = 4. 3 stripe multiplying 1 block = 3. ","The magic eggs with one stick - the black dots are subtractor the amount eggs is subtracted from the blocks","Na",7
"47",74,"5f28728180f0fe19843858a1","comp_const","1 line means it will stay the same 2 line multiplies the stick by 2 and 3 lines multiplies it by 3.","The dots take away from the sticks. 1 dot takes away 1 2 dots take away 2 etc.","thanks ",4
"48",75,"5df15d3e192ef006f48c6a49","comp_const","There was no change with the first egg. The second and third eggs have an increase of two bars after the tests.The difference between the second and the third egg is the increase in the number of bars for the third egg and the length of the bars.","The number of dots on the magic eggs reduces the number of bars available.","None.",1
"49",76,"60e771826453c010d62b89b4","comp_mult","Each egg with more than 1 stripe adds 2 blocks.","I think the odd number of dots either reduce or add blocks","None",3
"50",77,"542e816cfdf99b324f763432","comp_const","The length of the sticks is multiplied by the number of stripes in the egg.","Multiply number of sticks by number of stripes then subtract number of dots","Would love to know the answers and if I was right.     ",8
"51",78,"56e6f0dec89073000de74780","comp_mult_reverse","if the number of spots and stripes on an egg match then there is no change. if there is more spots than stripes then the stick gets shorter. if there are more stripes than dots the stick gets longer","if there is more than one stripe the stick gets longer by two","no comments",1
"52",79,"600ebf6fa6705e530801b77d","comp_mult","The stick length multiplies by the number of stripes on the magic egg when the magic egg and stick come into contact","The stick multiplies by the number of stripes minus the number of spots. ","Im really curious to see if I got it right!",10
"53",80,"614e20ab74f396ea8e097342","comp_mult","end length = original length x number of lines on egg","balls touching the lines cancel them out","no",7
"54",81,"5f59c9546350c10112d68b8b","comp_const","one stick does nothing two sticks adds length and three sticks adds length","the spots remove the same number of stick segments","This was an extremely baffling test and I just guessed the answers for most of them i think! ",2
"55",82,"615061fc3afd0aecb10a6658","comp_const","However many lines on the egg is how much the stick gets multiplied by.  1. 1 line so 3x1 =3 2. 2 lines so 2x2 =4 3. 3 lines so 1x3 = 3","Line is still times Dots take away one of each stick length each time.","No.",11
"56",83,"5a777777b093f80001a75721","comp_mult_reverse","The number of stripes and dots ratio of one to the other or maybe the position of the dots has some relation to long the stick grows. ","I honestly dont know at this point in the test. The combinations of dots and stripes seem to have random effect on the stick lengths","No",1
"57",84,"603cfe49880ceeb4bf3aa72e","comp_const","Only one stick adds nothing anything above that adds 2 on","The number of dots on the sticks take away the number of eggs","None ",2
"58",85,"60bf7a5899b04dd850c25700","comp_const","If the number of stripes on the egg is less than the existing number of segments on the stick it touches it adds the difference","I believe now that the dots are subtract and that the stripes are multipliers.  So I believe it multiplies by number of stripes and then subtracts the dots","It was quite hard to initially guess without having seen any spots in the examples first. I hope I ended up on the right page! ",6
"59",86,"602c64564ad77a557c5cc279","comp_const","The number of stripes on the egg is multiplied with the number of segments on the stick to make the answer which is expressed with the final number of segments on the stick.","The stripes are multiplied by the number of segments on the stick then the number of dots are subtracted from the total to give the final answer which is expressed by the number of segments on the stick.","na                   ",10
"60",87,"59e3dbd9ae9f950001d83ffb","comp_mult","The egg multiplies the amount of segments of the stick by the number of stripes on the egg","The stripes multiply the number of segments and the dots subtract one segment ","none",10
"61",88,"5e573ce57a25e30f431f8994","comp_mult_reverse","I think the stripes indicate what happens to the stick segments (addedremoved) and the dots indicate how many segments are addedremoved. For the stripes I think that 1 stripe will remove segments 2 stripes will not removeadd any segments and 3 stripes will add segments. I think the number of dots indicate how many segments are removed so in trial 1: 3 segments are removed because 1 line = remove segments 3 dots = remove 3 segments. Trial 2 = nothing changes because 2 lines = no segments removedadded regardless of dot number. Trial 3 = 1 segment added because 3 lines = add segments 1 dot = add 1 segment. ","I think one stripe means nothing changes two stripes mean that segments are added (number of segments added = number of stripes) and three stripes mean that the number of segments will equal the number of lines regardless of whether that means adding or removing segments. ","NA",2
"62",89,"5a7d74de8fe2dc000105b7e9","comp_mult","One stripe does nothing. Two or three stripes on the egg both increase the sticks by two segments. ","One dot on the egg cancels out one stripe but not sure.","I could not work out a pattern between the appearance of the eggs and the effect they were having on the sticks. It seemed quite random.",1
"63",90,"6147a2ed5708589b368853a8","comp_const","the number of stipes multiplys the length of the stick","if there is balls on the eggs depending how many there is it reduces the length of the stick that amount.","it was very difficult but fun. ",7
"64",91,"5d8da90433afc60017fae3d3","comp_const","Eggs with one stripe have no effect on a stick with 3 segments. Eggs with 2 stripes add 2 segments to a stick of 2 segments. Eggs with 3 stripes add 2 segments to a stick of 1 segment","one dot removes one segment therefore 2 dots remove 2 segments and so on","I enjoyed the experiment thank you I found it very engaging which is difficult in the times we live in to completely focus on one task.",1
"65",92,"5d2901e3cb80f3001924f769","comp_const","The eggs with multiple stripes (i.e. more than 1) increase the length of the stick by the multiple of the stripes so for 2 stripes...the original length is doubled for 3 stripes the original length is tripled.","How ever many dots there are...dictates the amount of length taken from the stick. So 1 dot steals 1 length of stick 2 dots 2 lengths","I found it really interesting but I have no idea if I was doing it right or not!",8
"66",93,"564a08bc6902220012c4b1a1","comp_mult_reverse","1 stripe = remove the number of segments that match the number of dots. 2 stripes = do not change the length of the stick 3 stripes = add the number of segments based on number of dots","Im really confused!  I think if there are no dots it is simple multiplication - so the number of stripe * the number of existing segments. I am unsure what the dots do though now.","It was really hard - I hope there is a debrief now that tells me the answer otherwise this is going to annoy me all day!",6
"67",94,"5c7bdeba628ace00145e29a7","comp_mult","If the egg has more or an equal number of stripes than the stick does segments then the number of segments of the stick increases by 2. If the egg has fewer stripes than the stick has segments it will have no affect.","If no. of stripes are more than or equal to number of segments the number of segments increases by two. If there are fewer stripes than segments then there is no change. If any dots are present the number of segments is reduced by the number of the dots.","na",2
"68",95,"60327d95fb5e6823d96d15a0","comp_mult_reverse","Three dots and one stripe does not increase the pieces what matters is the dots more than the sticks","The number of sticks increase the boxes","The experiment requires attention and reading the instructions carefully ",2
"69",96,"6164644cda075b1b7e711b88","comp_mult","The number of stripes on the egg is the multiplier against the number of sticks. so 1 x 3=3 (no change) 2x2=4 3 x 1=3","I think the same causal relationship as before stripes on the egg are a multiplier for the sticks. I think you then subtract the number of dots on the egg from the stick total.","I wanted to add minus one for one of the answers but wasnt able to (probably because it was incorrect!)",10
"70",97,"5fbe39bf0d0ce90a7eb0c791","comp_mult_reverse","less stripes shorten the stick same stripes keep stick the same length and more stripes make stick longer","If stripes are less than the stick then nothing happens but if stripes are same or more than the stick then increase length of stick by 2","no comments to make.                                                 ",3
